date,company,symbol,title,source,published,url,sentiment_score,recommendation
2025-11-20,Apple,AAPL,"Warren Buffett, Marjorie Taylor Greene Bet On The Same 9 Stocks - Here's What They Know - Apple  ( NASDAQ:AAPL ) , Amazon.com  ( NASDAQ:AMZN )",Benzinga,2025-11-20T15:47:11Z,https://www.benzinga.com/trading-ideas/movers/25/11/48978980/warren-buffett-marjorie-taylor-greene-bet-on-the-same-9-stocks-heres-what-they-know,0.6124,Buy
2025-11-20,Apple,AAPL,"How To Trade SPY, Top Tech Stocks Using Technical Analysis - Alphabet  ( NASDAQ:GOOGL ) , Apple  ( NASDAQ:AAPL )",Benzinga,2025-11-20T15:25:04Z,https://www.benzinga.com/Opinion/25/11/48977983/how-to-trade-spy-top-tech-stocks-using-technical-analysis-63,-0.0258,Hold
2025-11-20,Apple,AAPL,"Insights Into Apple's Performance Versus Peers In Technology Hardware, Storage & Peripherals Sector - Apple  ( NASDAQ:AAPL )",Benzinga,2025-11-20T15:00:42Z,https://www.benzinga.com/insights/news/25/11/48976633/insights-into-apples-performance-versus-peers-in-technology-hardware-storage-amp-peripherals-sector,0.4019,Buy
2025-11-20,Apple,AAPL,"Louisiana Rep. Cleo Fields Bought Over $216K Worth of Netflix Stock: Here's What You Should Know - Netflix  ( NASDAQ:NFLX ) , Apple  ( NASDAQ:AAPL )",Benzinga,2025-11-20T15:00:14Z,https://www.benzinga.com/insights/government/25/11/48976549/louisiana-rep-cleo-fields-bought-over-216k-worth-of-netflix-stock-heres-what-you-should-know,0.7184,Buy
2025-11-20,Apple,AAPL,"Trump Administration Mulls Delaying Semiconductor Tariffs To Avoid China Clash: Report - Apple  ( NASDAQ:AAPL ) ,  ( HXSCL )",Benzinga,2025-11-20T13:06:27Z,https://www.benzinga.com/markets/tech/25/11/48972777/trump-administration-mulls-delaying-semiconductor-tariffs-to-avoid-china-clash-report,-0.4767,Sell
2025-11-25,Microsoft,MSFT,Is iShares Paris-Aligned Climate MSCI USA ETF  ( PABU )  a Strong ETF Right Now?,Zacks Commentary,2025-11-25T11:20:03Z,https://www.zacks.com/stock/news/2795142/is-ishares-paris-aligned-climate-msci-usa-etf-pabu-a-strong-etf-right-now,0.7184,Buy
2025-11-25,Microsoft,MSFT,CEO Jensen Huang Just Delivered Fantastic News for Nvidia Investors,Motley Fool,2025-11-25T10:30:00Z,https://www.fool.com/investing/2025/11/25/ceo-jensen-huang-just-delivered-fantastic-news-for/,0.7351,Buy
2025-11-25,Microsoft,MSFT,1 Unstoppable Artificial Intelligence  ( AI )  Stock to Buy Before It Soars Into the $5 Trillion Club,Motley Fool,2025-11-25T09:58:00Z,https://www.fool.com/investing/2025/11/25/1-unstoppable-ai-stock-buy-soars-5-trillion-club/,0.8402,Buy
2025-11-25,Microsoft,MSFT,"3 Vanguard ETFs to Buy With $2,000 and Hold Forever",Motley Fool,2025-11-25T09:45:00Z,https://www.fool.com/investing/2025/11/25/3-vanguard-etfs-to-buy-with-2000-and-hold-forever/,0.4404,Buy
2025-11-25,Microsoft,MSFT,"3 Unstoppable Vanguard ETFs to Buy With $5,000 and Hold Forever",Motley Fool,2025-11-25T09:35:00Z,https://www.fool.com/investing/2025/11/25/unstoppable-vanguard-etf-buy-5000-hold-voo-vig/,0.6249,Buy
2025-11-25,Microsoft,MSFT,Why Did Amazon Sell Its IonQ Stock?,Motley Fool,2025-11-25T09:30:00Z,https://www.fool.com/investing/2025/11/25/why-did-amazon-sell-ionq-stock/,0.34,Buy
2025-11-25,Microsoft,MSFT,What Every Vistra Investor Should Know Before Buying,Motley Fool,2025-11-25T08:55:00Z,https://www.fool.com/investing/2025/11/25/what-vistra-stock-investor-should-know-before-buy/,0.1531,Buy
2025-11-25,Microsoft,MSFT,"2 Quantum Computing Stocks to Buy Before They Soar 128% and 132%, According to Certain Wall Street Analysts",Motley Fool,2025-11-25T08:45:00Z,https://www.fool.com/investing/2025/11/25/2-quantum-computing-stocks-to-buy-before-soar-132/,0.2732,Buy
2025-11-25,Microsoft,MSFT,"The Ultimate Growth Stock to Buy With $1,000 Right Now",Motley Fool,2025-11-25T08:15:00Z,https://www.fool.com/investing/2025/11/25/the-ultimate-growth-stock-to-buy-with-1000-right-n/,0.6369,Buy
2025-11-25,Microsoft,MSFT,HPQ's $30 Bet: Why 'Windows 10 Cliff' Matters More Than AI Hype In Q4 - HP  ( NYSE:HPQ ),Benzinga,2025-11-25T07:27:35Z,https://www.benzinga.com/markets/earnings/25/11/49049981/hpqs-30-bet-why-windows-10-cliff-matters-more-than-ai-hype-in-q4,-0.2732,Sell
2025-11-25,Microsoft,MSFT,Nasdaq Jumps 600 Points Amid Fed Dovish Signals: Fear & Greed Index Remains In 'Extreme Fear' Zone - Alphabet  ( NASDAQ:GOOGL ),Benzinga,2025-11-25T05:41:22Z,https://www.benzinga.com/markets/equities/25/11/49049351/nasdaq-jumps-600-points-amid-fed-dovish-signals-fear-greed-index-remains-in-extreme-fear-zone,-0.9637,Sell
2025-11-24,Microsoft,MSFT,Zoom  ( ZM )  Q3 2026 Earnings Call Transcript,Motley Fool,2025-11-24T23:08:31Z,https://www.fool.com/earnings/call-transcripts/2025/11/24/zoom-zm-q3-2026-earnings-call-transcript/,-0.4404,Sell
2025-11-24,Microsoft,MSFT,Mining economics tighten as record hashrate meets falling Bitcoin price: Report,Cointelegraph,2025-11-24T22:14:36Z,https://cointelegraph.com/news/mining-economics-hashrate-bitcoin-price-report,-0.4215,Sell
2025-11-24,Microsoft,MSFT,"Billionaire Peter Thiel Just Sold Nvidia and Tesla for These Other Two ""Magnificent Seven"" Stocks",Motley Fool,2025-11-24T22:00:00Z,https://www.fool.com/investing/2025/11/24/billionaire-peter-thiel-just-sold-nvidia-and-tesla/,0.5994,Buy
2025-11-24,Microsoft,MSFT,What's Going On With Microsoft Stock Monday? - Microsoft  ( NASDAQ:MSFT ),Benzinga,2025-11-24T21:12:51Z,https://www.benzinga.com/trading-ideas/movers/25/11/49044934/whats-going-on-with-microsoft-stock-monday,0.128,Buy
2025-11-24,Microsoft,MSFT,Tech Expert Stephanie Humphrey Shares Her Top Picks for This Holiday Season on YourUpdateTV,Benzinga,2025-11-24T20:59:52Z,https://www.benzinga.com/pressreleases/25/11/g49044163/tech-expert-stephanie-humphrey-shares-her-top-picks-for-this-holiday-season-on-yourupdatetv,0.8327,Buy
2025-11-24,Microsoft,MSFT,Could Buying IonQ Stock Today Set You Up for Life?,Motley Fool,2025-11-24T20:22:00Z,https://www.fool.com/investing/2025/11/24/could-buying-ionq-stock-today-set-you-up-for-life/,0.0,Hold
2025-11-24,Microsoft,MSFT,"Nvidia: There Was a Red Flag in Its Earnings Report, but Is the Stock Still a Buy?",Motley Fool,2025-11-24T20:20:00Z,https://www.fool.com/investing/2025/11/24/nvidia-there-was-a-red-flag-in-its-earnings-report/,0.0,Hold
2025-11-24,Microsoft,MSFT,Surgent CPE Launches First-of-Its-Kind Agentic AI CPE Series for Accounting and Finance Professionals,Benzinga,2025-11-24T19:39:18Z,https://www.benzinga.com/pressreleases/25/11/g49041802/surgent-cpe-launches-first-of-its-kind-agentic-ai-cpe-series-for-accounting-and-finance-profession,0.4019,Buy
2025-11-24,Microsoft,MSFT,You Won't Believe Who's Stealing Market Share From Amazon,Motley Fool,2025-11-24T18:54:00Z,https://www.fool.com/investing/2025/11/24/you-wont-believe-whos-stealing-market-share-from-a/,0.7094,Buy
2025-11-24,Microsoft,MSFT,JPMorgan Says Bitcoin Miners Are Entering A 'Higher-Conviction Phase': Here Are Its Price Targets,Benzinga,2025-11-24T18:39:27Z,https://www.benzinga.com/crypto/cryptocurrency/25/11/49039987/jpmorgan-says-bitcoin-miners-are-entering-a-higher-conviction-phase-here-are-its-price-targ,0.0,Hold
2025-11-24,Microsoft,MSFT,Warren Buffett Is Buying Artificial Intelligence  ( AI )  Stocks While Michael Burry Is Shorting Them -- Who's Right?,Motley Fool,2025-11-24T17:15:00Z,https://www.fool.com/investing/2025/11/24/warren-buffett-is-buying-artificial-intelligence-a/,0.4767,Buy
2025-11-24,Microsoft,MSFT,iPhone 17 Boosts Apple's China Sales: What's Ahead for the Stock?,Zacks Commentary,2025-11-24T16:53:00Z,https://www.zacks.com/stock/news/2794979/iphone-17-boosts-apples-china-sales-whats-ahead-for-the-stock,0.7351,Buy
2025-11-24,Microsoft,MSFT,Where Will Palantir Stock Be in 1 Year?,Motley Fool,2025-11-24T16:50:00Z,https://www.fool.com/investing/2025/11/24/where-will-palantir-stock-be-in-1-year/,-0.3612,Sell
2025-11-24,Microsoft,MSFT,MSFT vs. NOW: Which Cloud Software Provider Offers More Upside?,Zacks Commentary,2025-11-24T16:28:00Z,https://www.zacks.com/stock/news/2794943/msft-vs-now-which-cloud-software-provider-offers-more-upside,0.7906,Buy
2025-11-24,Microsoft,MSFT,"1 Vanguard ETF to Buy Now, 1 to Avoid",Motley Fool,2025-11-24T16:17:00Z,https://www.fool.com/investing/2025/11/24/1-vanguard-etf-to-buy-now-1-to-avoid/,-0.7227,Sell
2025-11-24,Microsoft,MSFT,What the Options Market Tells Us About Advanced Micro Devices - Advanced Micro Devices  ( NASDAQ:AMD ),Benzinga,2025-11-24T16:01:55Z,https://www.benzinga.com/insights/options/25/11/49033799/what-the-options-market-tells-us-about-advanced-micro-devices,0.7184,Buy
2025-11-24,Microsoft,MSFT,A Closer Look at Microsoft's Options Market Dynamics - Microsoft  ( NASDAQ:MSFT ),Benzinga,2025-11-24T15:02:27Z,https://www.benzinga.com/insights/options/25/11/49031310/a-closer-look-at-microsofts-options-market-dynamics,0.2732,Buy
2025-11-24,Microsoft,MSFT,Comparative Study: Microsoft And Industry Competitors In Software Industry - Microsoft  ( NASDAQ:MSFT ),Benzinga,2025-11-24T15:00:34Z,https://www.benzinga.com/insights/news/25/11/49031209/comparative-study-microsoft-and-industry-competitors-in-software-industry,0.4576,Buy
2025-11-24,Microsoft,MSFT,"A Congress Member Bought Up To $500K In Microsoft Stock: Here's What You Need To Know - Microsoft  ( NASDAQ:MSFT ) , Intuitive Surgical  ( NASDAQ:ISRG )",Benzinga,2025-11-24T15:00:29Z,https://www.benzinga.com/insights/government/25/11/49031204/a-congress-member-bought-up-to-500k-in-microsoft-stock-heres-what-you-need-to-know,0.6249,Buy
2025-11-24,Microsoft,MSFT,Microsoft and Nvidia Just Signed a Multibillion-Dollar Deal With Anthropic. Here's What It Really Means for Investors.,Motley Fool,2025-11-24T14:30:00Z,https://www.fool.com/investing/2025/11/24/microsoft-and-nvidia-just-signed-a-multibillion-do/,0.0,Hold
2025-11-24,Microsoft,MSFT,ASTS vs. IBM: Which Connectivity Innovator is the Better Buy Today?,Zacks Commentary,2025-11-24T14:03:00Z,https://www.zacks.com/stock/news/2794686/asts-vs-ibm-which-connectivity-innovator-is-the-better-buy-today,0.886,Buy
2025-11-24,Microsoft,MSFT,"Ranking the Best ""Magnificent Seven"" Stocks to Buy for 2026. Here's My No. 6 Pick.",Motley Fool,2025-11-24T13:59:31Z,https://www.fool.com/investing/2025/11/24/buy-magnificent-seven-stocks-2026-apple/,0.6542,Buy
2025-11-24,Microsoft,MSFT,"How To Trade SPY, Top Tech Stocks Using Technical Analysis - Alphabet  ( NASDAQ:GOOGL ) , Apple  ( NASDAQ:AAPL )",Benzinga,2025-11-24T13:35:57Z,https://www.benzinga.com/Opinion/25/11/49028639/how-to-trade-spy-top-tech-stocks-using-technical-analysis-64,0.8735,Buy
2025-11-24,Microsoft,MSFT,Why Micron and SK Hynix Could Quietly Become the Real AI Winners,Motley Fool,2025-11-24T13:09:00Z,https://www.fool.com/investing/2025/11/24/why-micron-and-sk-hynix-could-quietly-become-the-r/,0.8271,Buy
2025-11-24,Microsoft,MSFT,Three Vanguard ETFs Poised for Outsized Gains,Motley Fool,2025-11-24T13:02:00Z,https://www.fool.com/investing/2025/11/24/three-vanguard-etfs-poised-for-outsized-gains/,0.7906,Buy
2025-11-24,Microsoft,MSFT,This Is the Best AI Stock to Buy as Spending Shifts Toward Hardware,Motley Fool,2025-11-24T12:30:00Z,https://www.fool.com/investing/2025/11/24/best-ai-stock-to-buy-spending-shifts-hardware/,0.802,Buy
2025-11-24,Microsoft,MSFT,"Ming-Chi Kuo Slams 'Factual Errors' In Criticisms Around Nvidia's Financial 'Fraud:' 'Far From Being Evidence...' - Microsoft  ( NASDAQ:MSFT ) , NVIDIA  ( NASDAQ:NVDA )",Benzinga,2025-11-24T12:12:55Z,https://www.benzinga.com/analyst-stock-ratings/analyst-color/25/11/49027315/ming-chi-kuo-fires-back-at-nvidia-fraud-critics-says-claims-are-built-on-fact,-0.6808,Sell
2025-11-24,Microsoft,MSFT,"Michael Saylor's Strategy is bleeding, but its Bitcoin bet isn't",Cointelegraph,2025-11-24T11:24:15Z,https://cointelegraph.com/news/microstrategy-stock-bitcoin-bet-still-working,0.7368,Buy
2025-11-24,Microsoft,MSFT,Should State Street SPDR Portfolio S&P 500 Growth ETF  ( SPYG )  Be on Your Investing Radar?,Zacks Commentary,2025-11-24T11:20:04Z,https://www.zacks.com/stock/news/2794514/should-state-street-spdr-portfolio-sp-500-growth-etf-spyg-be-on-your-investing-radar,0.3818,Buy
2025-11-24,Microsoft,MSFT,Is FlexShares Morningstar U.S. Market Factor Tilt ETF  ( TILT )  a Strong ETF Right Now?,Zacks Commentary,2025-11-24T11:20:04Z,https://www.zacks.com/stock/news/2794518/is-flexshares-morningstar-us-market-factor-tilt-etf-tilt-a-strong-etf-right-now,0.7184,Buy
2025-11-24,Microsoft,MSFT,Is Schwab Fundamental U.S. Large Company ETF  ( FNDX )  a Strong ETF Right Now?,Zacks Commentary,2025-11-24T11:20:03Z,https://www.zacks.com/stock/news/2794527/is-schwab-fundamental-us-large-company-etf-fndx-a-strong-etf-right-now,0.7184,Buy
2025-11-24,Microsoft,MSFT,"Stock Market Today: Dow Jones, S&P 500 Futures Rise As Fed Hints At Possibility Of December Cut - Pony AI, Alphabet, Zoom In Focus - SPDR S&P 500  ( ARCA:SPY )",Benzinga,2025-11-24T10:34:18Z,https://www.benzinga.com/markets/equities/25/11/49026014/stock-market-today-dow-jones-sp-500-futures-rise-as-fed-hints-at-possibility-of-december-cut-pon,0.0772,Buy
2025-11-24,Microsoft,MSFT,"The Zacks Analyst Blog ServiceNow, Microsoft, Atlassian and Salesforce",Zacks Commentary,2025-11-24T10:30:00Z,https://www.zacks.com/stock/news/2794507/the-zacks-analyst-blog-servicenow-microsoft-atlassian-and-salesforce,0.4019,Buy
2025-11-24,Microsoft,MSFT,Could Buying the iShares Russell 2000 Growth ETF  ( IWO )  Today Set You Up for Life?,Motley Fool,2025-11-24T09:45:00Z,https://www.fool.com/investing/2025/11/24/could-buying-ishares-russell-2000-growth-etf-iwo/,-0.0923,Sell
2025-11-24,Microsoft,MSFT,"Which Quantum Computing Stock Is Wall Street Most Bullish About: D-Wave Quantum, IonQ, or Rigetti?",Motley Fool,2025-11-24T09:44:00Z,https://www.fool.com/investing/2025/11/24/which-quantum-computing-stock-is-wall-street-most/,0.6956,Buy
2025-11-24,Microsoft,MSFT,1 Spectacular Warren Buffett-Approved Index Fund That Could Turn $500 Per Month Into $1 Million,Motley Fool,2025-11-24T09:17:00Z,https://www.fool.com/investing/2025/11/24/1-warren-buffett-index-fund-turn-500-month-1-milli/,0.8074,Buy
2025-11-24,Microsoft,MSFT,"This Is the Biggest Risk to Quantum Computing Stocks IonQ, Rigetti Computing, and D-Wave Quantum, and It's Gone Virtually Undetected by Investors",Motley Fool,2025-11-24T08:51:00Z,https://www.fool.com/investing/2025/11/24/biggest-risk-to-quantum-computing-stocks-ionq-rgti/,-0.0772,Sell
2025-11-24,Microsoft,MSFT,Anthropic Will Spend $30 Billion on Azure. Could This Be Microsoft's Most Important AI Deal Yet?,Motley Fool,2025-11-24T08:25:00Z,https://www.fool.com/investing/2025/11/24/anthropic-spend-billion-azure-microsoft/,0.2716,Buy
2025-11-24,Microsoft,MSFT,Could the Anthropic Partnership Be Nvidia's Most Important AI Deal Yet?,Motley Fool,2025-11-24T07:30:00Z,https://www.fool.com/investing/2025/11/24/could-the-anthropic-partnership-be-nvidias-most-im/,0.8439,Buy
2025-11-25,Amazon,AMZN,Where Will UPS Be in 1 Year?,Motley Fool,2025-11-25T12:06:00Z,https://www.fool.com/investing/2025/11/25/where-will-ups-be-in-1-year/,0.4404,Buy
2025-11-25,Amazon,AMZN,Should iShares Russell 1000 Value ETF  ( IWD )  Be on Your Investing Radar?,Zacks Commentary,2025-11-25T11:20:03Z,https://www.zacks.com/stock/news/2795135/should-ishares-russell-1000-value-etf-iwd-be-on-your-investing-radar,0.34,Buy
2025-11-25,Amazon,AMZN,E-Commerce Adoption Still Has 83.7% to Go: Buy This Market Leader Now,Motley Fool,2025-11-25T10:45:00Z,https://www.fool.com/investing/2025/11/25/e-commerce-adoption-still-has-837-buy-this-market/,0.1779,Buy
2025-11-25,Amazon,AMZN,"Want Over $7,000 in Annual Dividends? Invest $25,000 in Each of These 4 Stocks.",Motley Fool,2025-11-25T10:30:00Z,https://www.fool.com/investing/2025/11/25/want-over-7000-in-annual-dividends-invest-25000-in/,0.1779,Buy
2025-11-25,Amazon,AMZN,Why Did Amazon Sell Its IonQ Stock?,Motley Fool,2025-11-25T09:30:00Z,https://www.fool.com/investing/2025/11/25/why-did-amazon-sell-ionq-stock/,0.34,Buy
2025-11-25,Amazon,AMZN,3 Leading Tech Stocks to Buy in 2025,Motley Fool,2025-11-25T09:20:00Z,https://www.fool.com/investing/2025/11/25/3-leading-tech-stocks-to-buy-in-2025/,0.5719,Buy
2025-11-25,Amazon,AMZN,"The Ultimate Growth Stock to Buy With $1,000 Right Now",Motley Fool,2025-11-25T08:15:00Z,https://www.fool.com/investing/2025/11/25/the-ultimate-growth-stock-to-buy-with-1000-right-n/,0.6369,Buy
2025-11-25,Amazon,AMZN,"Amazon Orders Staff To Ditch Rival AI Coding Tools As It Pushes Kiro To Close Gap With OpenAI, Google - Alphabet  ( NASDAQ:GOOG ) , Amazon.com  ( NASDAQ:AMZN )",Benzinga,2025-11-25T07:01:13Z,https://www.benzinga.com/markets/tech/25/11/49049703/amazon-orders-staff-to-ditch-rival-ai-coding-tools-as-it-pushes-kiro-to-close-gap-with-openai-google,-0.25,Sell
2025-11-25,Amazon,AMZN,1 Growth Stock I'm Thankful for -- and the Unstoppable Stock I'm Buying Using the Lessons It Taught Me,Motley Fool,2025-11-25T02:41:00Z,https://www.fool.com/investing/2025/11/24/1-growth-stock-im-thankful-for-and-the-unstoppable/,0.5267,Buy
2025-11-24,Amazon,AMZN,"Biggest Stock Movers Today, Nov. 24: AVGO, NVO, & More",Motley Fool,2025-11-24T21:49:36Z,https://www.fool.com/investing/2025/11/24/biggest-stock-movers-today-nov-24-avgo-nvo-more/,0.4019,Buy
2025-11-24,Amazon,AMZN,Why Shares of Palantir Soared Today,Motley Fool,2025-11-24T21:06:29Z,https://www.fool.com/investing/2025/11/24/why-shares-of-palantir-soared-today/,0.6486,Buy
2025-11-24,Amazon,AMZN,Could Buying IonQ Stock Today Set You Up for Life?,Motley Fool,2025-11-24T20:22:00Z,https://www.fool.com/investing/2025/11/24/could-buying-ionq-stock-today-set-you-up-for-life/,0.0,Hold
2025-11-24,Amazon,AMZN,You Won't Believe Who's Stealing Market Share From Amazon,Motley Fool,2025-11-24T18:54:00Z,https://www.fool.com/investing/2025/11/24/you-wont-believe-whos-stealing-market-share-from-a/,0.7094,Buy
2025-11-24,Amazon,AMZN,"WeShop's 'Own What You Buy' Pitch Threatens To Crash Amazon's Prime Party - WeShop Holdings  ( NASDAQ:WSHP ) , Amazon.com  ( NASDAQ:AMZN )",Benzinga,2025-11-24T18:43:13Z,https://www.benzinga.com/trading-ideas/long-ideas/25/11/49040156/weshops-own-what-you-buy-pitch-threatens-to-crash-amazons-prime-party,-0.5759,Sell
2025-11-24,Amazon,AMZN,Amazon Stock Is Moving Higher Monday: What's Going On? - Amazon.com  ( NASDAQ:AMZN ),Benzinga,2025-11-24T18:04:19Z,https://www.benzinga.com/markets/tech/25/11/49039033/amazon-plans-huge-ai-upgrade-to-transform-federal-intelligence-and-security,0.8555,Buy
2025-11-24,Amazon,AMZN,Why Is Amazon Stock Gaining Monday? - Amazon.com  ( NASDAQ:AMZN ),Benzinga,2025-11-24T17:04:29Z,https://www.benzinga.com/markets/tech/25/11/49036766/amazon-leo-satellite-internet-now-in-commercial-preview,0.7269,Buy
2025-11-24,Amazon,AMZN,Chewy Customer Growth Picks Up: Higher NSPAC Signals Stronger Spend,Zacks Commentary,2025-11-24T16:11:00Z,https://www.zacks.com/stock/news/2794938/chewy-customer-growth-picks-up-higher-nspac-signals-stronger-spend,0.93,Buy
2025-11-24,Amazon,AMZN,Competitor Analysis: Evaluating Amazon.com And Competitors In Broadline Retail Industry - Amazon.com  ( NASDAQ:AMZN ),Benzinga,2025-11-24T15:01:04Z,https://www.benzinga.com/insights/news/25/11/49031234/competitor-analysis-evaluating-amazon-com-and-competitors-in-broadline-retail-industry,0.4576,Buy
2025-11-24,Amazon,AMZN,What's Going On With Amazon Stock Monday? - Amazon.com  ( NASDAQ:AMZN ),Benzinga,2025-11-24T14:34:52Z,https://www.benzinga.com/markets/tech/25/11/49029866/amazon-runs-900-data-centers-to-fuel-ai-demand-report,0.34,Buy
2025-11-24,Amazon,AMZN,Microsoft and Nvidia Just Signed a Multibillion-Dollar Deal With Anthropic. Here's What It Really Means for Investors.,Motley Fool,2025-11-24T14:30:00Z,https://www.fool.com/investing/2025/11/24/microsoft-and-nvidia-just-signed-a-multibillion-do/,0.0,Hold
2025-11-24,Amazon,AMZN,My 2 Favorite Stocks to Buy Right Now,Motley Fool,2025-11-24T14:22:00Z,https://www.fool.com/investing/2025/11/24/my-2-favorite-stocks-to-buy-right-now/,0.6808,Buy
2025-11-24,Amazon,AMZN,Best Health & Fitness Stocks for Investors Betting on Wellness,Zacks Commentary,2025-11-24T14:11:00Z,https://www.zacks.com/stock/news/2794693/best-health-fitness-stocks-for-investors-betting-on-wellness,0.9217,Buy
2025-11-24,Amazon,AMZN,3 Must-Watch Stocks Amid the Growing Gig Economy Popularity,Zacks Commentary,2025-11-24T13:21:00Z,https://www.zacks.com/stock/news/2794590/3-must-watch-stocks-amid-the-growing-gig-economy-popularity,0.9313,Buy
2025-11-24,Amazon,AMZN,3 Genius Stocks Billionaire Stanley Druckenmiller Just Bought,Motley Fool,2025-11-24T11:00:00Z,https://www.fool.com/investing/2025/11/24/3-genius-stocks-billionaire-stanley-druckenmiller/,0.0,Hold
2025-11-24,Amazon,AMZN,"This Is the Biggest Risk to Quantum Computing Stocks IonQ, Rigetti Computing, and D-Wave Quantum, and It's Gone Virtually Undetected by Investors",Motley Fool,2025-11-24T08:51:00Z,https://www.fool.com/investing/2025/11/24/biggest-risk-to-quantum-computing-stocks-ionq-rgti/,-0.0772,Sell
2025-11-24,Amazon,AMZN,3 Top Tech Stocks to Buy in November,Motley Fool,2025-11-24T01:26:00Z,https://www.fool.com/investing/2025/11/23/3-top-tech-stocks-to-buy-in-november/,0.34,Buy
2025-11-23,Amazon,AMZN,Is Netflix Stock a Buy After the 10-for-1 Stock Split?,Motley Fool,2025-11-23T23:10:00Z,https://www.fool.com/investing/2025/11/23/is-netflix-stock-a-buy-after-the-10-for-1-stock-sp/,0.5775,Buy
2025-11-23,Amazon,AMZN,3 Artificial Intelligence Stocks You Can Buy and Hold for the Next Decade,Motley Fool,2025-11-23T22:07:00Z,https://www.fool.com/investing/2025/11/23/3-artificial-intelligence-stocks-to-buy-and-hold/,0.7351,Buy
2025-11-23,Amazon,AMZN,"Here Is Jeff Bezos' Most Expensive Investment, And It Is The Largest In The World - Amazon.com  ( NASDAQ:AMZN )",Benzinga,2025-11-23T19:50:46Z,https://www.benzinga.com/personal-finance/entrepreneurship/25/11/49022698/here-is-jeff-bezos-most-expensive-investment-and-it-is-the-largest-in-the-world,0.3818,Buy
2025-11-23,Amazon,AMZN,Why Nvidia Could Be a Bigger Winner in Quantum Computing Than You Might Think,Motley Fool,2025-11-23T19:45:00Z,https://www.fool.com/investing/2025/11/23/why-nvidia-could-be-a-bigger-winner-in-quantum-com/,0.5859,Buy
2025-11-23,Amazon,AMZN,"Ranking the Best ""Magnificent Seven"" Stocks to Buy for 2026. Here's My No. 7 Pick.",Motley Fool,2025-11-23T18:05:00Z,https://www.fool.com/investing/2025/11/23/ranking-magnificent-seven-stocks-buy-2026-seven/,0.7814,Buy
2025-11-23,Amazon,AMZN,Alphabet Is Well Positioned for the Next Decade of AI Growth,Motley Fool,2025-11-23T13:25:00Z,https://www.fool.com/investing/2025/11/23/alphabet-is-well-positioned-for-the-next-decade-of/,0.5719,Buy
2025-11-23,Amazon,AMZN,Why Berkshire Hathaway's Stake in Alphabet Could Be Just the Start of Many More Tech Moves to Come,Motley Fool,2025-11-23T06:05:00Z,https://www.fool.com/investing/2025/11/23/why-berkshire-hathaways-stake-in-alphabet-could-be/,0.296,Buy
2025-11-23,Amazon,AMZN,"3 Vanguard ETFs to Buy With $1,000 and Hold Forever",Motley Fool,2025-11-23T00:30:00Z,https://www.fool.com/investing/2025/11/22/3-vanguard-etfs-to-buy-with-1000-and-hold-forever/,0.4404,Buy
2025-11-23,Amazon,AMZN,Should You Buy Nvidia Stock After the Company's Blowout Earnings Report? Here's What History Says.,Motley Fool,2025-11-23T00:10:00Z,https://www.fool.com/investing/2025/11/22/should-you-buy-nvidia-after-blowout-earnings/,0.0,Hold
2025-11-22,Amazon,AMZN,Billionaire Warren Buffett Owns 6 Dow Jones Stocks. Here's My Top Buy for 2026.,Motley Fool,2025-11-22T23:05:00Z,https://www.fool.com/investing/2025/11/22/billionaire-warren-buffett-buy-dow-stocks-2026/,0.8658,Buy
2025-11-22,Amazon,AMZN,Billionaire Stanley Druckenmiller Just Bought These 3 AI Stocks. Should Investors Follow Suit?,Motley Fool,2025-11-22T20:17:00Z,https://www.fool.com/investing/2025/11/22/billionaire-stanley-druckenmiller-just-bought-thes/,0.1779,Buy
2025-11-22,Amazon,AMZN,"Quantum Computing Stocks: How the Quantum Computing Players Stack Up by Patents  ( Yes, Nvidia Has Such Patents )",Motley Fool,2025-11-22T17:00:00Z,https://www.fool.com/investing/2025/11/22/quantum-computing-stocks-quantum-computing-patents/,0.6597,Buy
2025-11-22,Amazon,AMZN,Prediction: These Stocks Will Join the $3 Trillion Club in 3 Years,Motley Fool,2025-11-22T16:00:00Z,https://www.fool.com/investing/2025/11/22/prediction-these-stocks-will-join-the-3-trillion-c/,0.296,Buy
2025-11-22,Amazon,AMZN,3 Reasons to Buy Nu Stock Like There's No Tomorrow,Motley Fool,2025-11-22T13:15:00Z,https://www.fool.com/investing/2025/11/22/3-reasons-to-buy-nu-stock-like-theres-no-tomorrow/,0.7269,Buy
2025-11-22,Amazon,AMZN,Understanding Michael Burry's Bet Against AI: Here's What it Really Means for Investors,Motley Fool,2025-11-22T12:00:00Z,https://www.fool.com/investing/2025/11/22/understand-michael-burry-bet-against-ai-means/,0.0,Hold
2025-11-22,Amazon,AMZN,My 3 Favorite Stocks to Buy Right Now,Motley Fool,2025-11-22T11:05:00Z,https://www.fool.com/investing/2025/11/22/my-3-favorite-stocks-to-buy-right-now/,0.5719,Buy
2025-11-22,Amazon,AMZN,3 Reasons to Buy Walmart Stock Like There's No Tomorrow,Motley Fool,2025-11-22T08:14:00Z,https://www.fool.com/investing/2025/11/22/3-reasons-to-buy-walmart-stock-like-theres-no-tomo/,0.0387,Hold
2025-11-22,Amazon,AMZN,Billionaire Bill Ackman Just Sold This Hot Artificial Intelligence Stock. Here's Why Wall Street Thinks He Made a Big Mistake.,Motley Fool,2025-11-22T07:45:00Z,https://www.fool.com/investing/2025/11/22/billionaire-bill-ackman-just-sold-this-hot-artific/,0.6461,Buy
2025-11-22,Amazon,AMZN,"Bernie Sanders Asks Whether AI Will Really Serve Workers Or 'What Mr Musk And Mr Bezos Have In Mind' As Geoffrey Hinton Reveals The Real Risk - Apple  ( NASDAQ:AAPL ) , Amazon.com  ( NASDAQ:AMZN )",Benzinga,2025-11-22T07:26:32Z,https://www.benzinga.com/markets/tech/25/11/49020085/bernie-sanders-asks-whether-ai-will-really-serve-workers-or-what-mr-musk-and-mr-bezos-have-in-mind-a,0.6652,Buy
