date,company,symbol,title,source,published,url,sentiment_score,recommendation
2025-11-25,NVIDIA,NVDA,"Nokia Canada breaks ground on new Ottawa innovation campus, helping to shape the future of Canadian Tech leadership",GlobeNewswire,2025-11-25T12:30:00Z,https://www.globenewswire.com/news-release/2025/11/25/3194225/0/en/Nokia-Canada-breaks-ground-on-new-Ottawa-innovation-campus-helping-to-shape-the-future-of-Canadian-Tech-leadership.html,0.5859,Buy
2025-11-25,NVIDIA,NVDA,Prediction: This Will Be Nvidia's Stock Price 12 Months From Now,Motley Fool,2025-11-25T12:15:00Z,https://www.fool.com/investing/2025/11/25/prediction-this-will-be-nvidias-stock-price-12-mon/,0.0,Hold
2025-11-25,NVIDIA,NVDA,Why Is Everyone Talking About Nvidia Stock?,Motley Fool,2025-11-25T12:00:00Z,https://www.fool.com/investing/2025/11/25/why-is-everyone-talking-about-nvidia-stock/,-0.3182,Sell
2025-11-25,NVIDIA,NVDA,"Is AI in a Bubble, or Is the Rest of the Economy About to Pop?",Motley Fool,2025-11-25T11:35:00Z,https://www.fool.com/investing/2025/11/25/is-ai-in-a-bubble-or-is-the-rest-of-the-economy-ab/,0.0,Hold
2025-11-25,NVIDIA,NVDA,What's Going On With Nvidia Stock?,Motley Fool,2025-11-25T11:30:00Z,https://www.fool.com/investing/2025/11/25/whats-going-on-with-nvidia-stock/,-0.2018,Sell
2025-11-25,NVIDIA,NVDA,Is iShares Paris-Aligned Climate MSCI USA ETF  ( PABU )  a Strong ETF Right Now?,Zacks Commentary,2025-11-25T11:20:03Z,https://www.zacks.com/stock/news/2795142/is-ishares-paris-aligned-climate-msci-usa-etf-pabu-a-strong-etf-right-now,0.7184,Buy
2025-11-25,NVIDIA,NVDA,Interested in AI Stocks? You Might Consider Buying This Top AI ETF That's Returned 210% in 3 Years,Motley Fool,2025-11-25T11:00:00Z,https://www.fool.com/investing/2025/11/25/best-ai-etf-exchange-traded-fund-best-ai-stocks/,0.1027,Buy
2025-11-25,NVIDIA,NVDA,Is Nvidia Wrong About the AI Market?,Motley Fool,2025-11-25T10:30:00Z,https://www.fool.com/investing/2025/11/25/is-nvidia-wrong-about-the-ai-market/,-0.7476,Sell
2025-11-25,NVIDIA,NVDA,CEO Jensen Huang Just Delivered Fantastic News for Nvidia Investors,Motley Fool,2025-11-25T10:30:00Z,https://www.fool.com/investing/2025/11/25/ceo-jensen-huang-just-delivered-fantastic-news-for/,0.7351,Buy
2025-11-25,NVIDIA,NVDA,"Alibaba Faces Q2 Risks, Warns Analyst: Cites Nvidia Chip Ban, Declining Cash Flow Margins - Alibaba Gr Hldgs  ( NYSE:BABA )",Benzinga,2025-11-25T10:08:21Z,https://www.benzinga.com/markets/earnings/25/11/49051026/alibaba-faces-q2-risks-warns-analyst-cites-nvidia-chip-ban-declining-cash-flow-margins,-0.5859,Sell
2025-11-25,NVIDIA,NVDA,Artificial Intelligence Bubble? Not According to Nvidia's CEO Jensen Huang,Motley Fool,2025-11-25T10:05:00Z,https://www.fool.com/investing/2025/11/25/artificial-intelligence-bubble-nvidia-huang/,0.4767,Buy
2025-11-25,NVIDIA,NVDA,Is Google a Massive Threat to Nvidia?,Motley Fool,2025-11-25T10:00:00Z,https://www.fool.com/investing/2025/11/25/is-google-a-massive-threat-to-nvidia/,-0.8353,Sell
2025-11-25,NVIDIA,NVDA,1 Unstoppable Artificial Intelligence  ( AI )  Stock to Buy Before It Soars Into the $5 Trillion Club,Motley Fool,2025-11-25T09:58:00Z,https://www.fool.com/investing/2025/11/25/1-unstoppable-ai-stock-buy-soars-5-trillion-club/,0.8402,Buy
2025-11-25,NVIDIA,NVDA,"Better Buy for 2026: An S&P 500 Index Fund, Gold, or Bitcoin?",Motley Fool,2025-11-25T09:50:00Z,https://www.fool.com/investing/2025/11/25/buy-2026-sp-500-stocks-gold-bitcoin/,0.7845,Buy
2025-11-25,NVIDIA,NVDA,"3 Vanguard ETFs to Buy With $2,000 and Hold Forever",Motley Fool,2025-11-25T09:45:00Z,https://www.fool.com/investing/2025/11/25/3-vanguard-etfs-to-buy-with-2000-and-hold-forever/,0.4404,Buy
2025-11-25,NVIDIA,NVDA,This Nvidia Flex by the Company's CFO May Have Exposed a Massive Future Growth Weakness,Motley Fool,2025-11-25T08:51:00Z,https://www.fool.com/investing/2025/11/25/nvidia-flex-by-cfo-exposed-massive-growth-weakness/,0.5106,Buy
2025-11-25,NVIDIA,NVDA,"2 Quantum Computing Stocks to Buy Before They Soar 128% and 132%, According to Certain Wall Street Analysts",Motley Fool,2025-11-25T08:45:00Z,https://www.fool.com/investing/2025/11/25/2-quantum-computing-stocks-to-buy-before-soar-132/,0.2732,Buy
2025-11-25,NVIDIA,NVDA,"The Zacks Analyst Blog Highlights LLY, EPHE, BBC, HELX, XHS and SURI",Zacks Commentary,2025-11-25T08:44:00Z,https://www.zacks.com/stock/news/2795105/the-zacks-analyst-blog-highlights-lly-ephe-bbc-helx-xhs-and-suri,-0.4404,Sell
2025-11-25,NVIDIA,NVDA,"The Zacks Analyst Blog Highlights IonQ, D-Wave Quantum, The Defiance Quantum Computing ETF, IBM and NVIDIA",Zacks Commentary,2025-11-25T08:36:00Z,https://www.zacks.com/stock/news/2795103/the-zacks-analyst-blog-highlights-ionq-d-wave-quantum-the-defiance-quantum-computing-etf-ibm-and-nvidia,0.0,Hold
2025-11-25,NVIDIA,NVDA,"The Ultimate Growth Stock to Buy With $1,000 Right Now",Motley Fool,2025-11-25T08:15:00Z,https://www.fool.com/investing/2025/11/25/the-ultimate-growth-stock-to-buy-with-1000-right-n/,0.6369,Buy
2025-11-25,NVIDIA,NVDA,"Prediction: This Unstoppable Stock Will Soar to $20 Trillion by 2030, According to a Certain Wall Street Analyst",Motley Fool,2025-11-25T08:02:00Z,https://www.fool.com/investing/2025/11/25/prediction-unstoppable-stock-soar-20-trillion/,0.6249,Buy
2025-11-25,NVIDIA,NVDA,Nvidia Denies Enron Comparisons: Newman Slams Bear Thesis On Accounting Issues As 'Garbage' - NVIDIA  ( NASDAQ:NVDA ),Benzinga,2025-11-25T07:44:56Z,https://www.benzinga.com/markets/equities/25/11/49050204/nvidia-denies-enron-comparisons-newman-slams-bear-thesis-on-accounting-issues-as-garbage,-0.8885,Sell
2025-11-25,NVIDIA,NVDA,'Big Short' Michael Burry Doubles Down On Bear Case After Nvidia Pushes Back In Wall Street Note - NVIDIA  ( NASDAQ:NVDA ),Benzinga,2025-11-25T07:13:09Z,https://www.benzinga.com/markets/equities/25/11/49049747/big-short-michael-burry-doubles-down-on-bear-case-after-nvidia-pushes-back-in-wall-street-note,-0.4019,Sell
2025-11-25,NVIDIA,NVDA,"Bernie Sanders Pushes Back On Trump Moves To Strip AI Powers From States: 'It Will Make The Oligarchs Richer While Millions Lose Jobs' - NVIDIA  ( NASDAQ:NVDA ) , Amazon.com  ( NASDAQ:AMZN )",Benzinga,2025-11-25T05:03:01Z,https://www.benzinga.com/markets/tech/25/11/49049176/bernie-sanders-pushes-back-on-trump-moves-to-strip-ai-powers-from-states-it-will-make-the-oligarchs-,0.5574,Buy
2025-11-25,NVIDIA,NVDA,"Cathie Wood Drops $32 Million On CoreWeave Stock, Buys Bitcoin Dip Via ARKB - Ark Invest Also Picks Shares Of This George Soros-Backed Company - CoreWeave  ( NASDAQ:CRWV )",Benzinga,2025-11-25T02:31:35Z,https://www.benzinga.com/etfs/broad-u-s-equity-etfs/25/11/49048532/cathie-wood-drops-32-million-on-coreweave-stock-buys-bitcoin-dip-via-arkb-ark-invest-a,0.6369,Buy
2025-11-25,NVIDIA,NVDA,Xi Jinping Says US-China Trade Relations Maintain Positive Momentum As Trump Considers Allowing Nvidia AI Chip Sales To Beijing - NVIDIA  ( NASDAQ:NVDA ),Benzinga,2025-11-25T02:20:50Z,https://www.benzinga.com/markets/tech/25/11/49048485/xi-jinping-says-us-china-trade-relations-maintain-positive-momentum-as-trump-considers-allowing-nvid,0.7506,Buy
2025-11-25,NVIDIA,NVDA,Musk Says Real-World Data From X and Tesla to Drive AGI Efforts,Decrypt.co,2025-11-25T02:13:55Z,https://decrypt.co/349920/musk-real-world-data-x-tesla-drive-agi-efforts,-0.3182,Sell
2025-11-25,NVIDIA,NVDA,This Artificial Intelligence  ( AI )  and Robotics Stock Has Crushed Nvidia and Palantir This Year. It Can Still Soar Higher.,Motley Fool,2025-11-25T01:49:33Z,https://www.fool.com/investing/2025/11/24/artificial-intelligence-ai-and-robotics-stock/,0.7845,Buy
2025-11-25,NVIDIA,NVDA,"Broadcom, Alphabet, Sandisk, Novo Nordisk And Zoom: Why These 5 Stocks Are On Investors' Radars Today - Alphabet  ( NASDAQ:GOOG )",Benzinga,2025-11-25T01:13:52Z,https://www.benzinga.com/markets/equities/25/11/49048055/broadcom-alphabet-sandisk-novo-nordisk-and-zoom-why-these-5-stocks-are-on-investors-radars-today,0.5859,Buy
2025-11-25,NVIDIA,NVDA,Where Will Micron Stock Be in 3 Years?,Motley Fool,2025-11-25T01:00:00Z,https://www.fool.com/investing/2025/11/24/where-will-micron-stock-be-in-3-years/,0.4767,Buy
2025-11-24,NVIDIA,NVDA,Trump Signs 'Genesis Mission' Executive Order to Use AI to Supercharge US Innovation,Decrypt.co,2025-11-24T23:45:16Z,https://decrypt.co/349899/trump-signs-genesis-mission-executive-order-ai-us-innovation,0.7269,Buy
2025-11-24,NVIDIA,NVDA,Alphabet Stocks Hits New Highs As Meta Mulls Deploying Google AI Chips In Data Centers - Alphabet  ( NASDAQ:GOOG ),Benzinga,2025-11-24T23:34:32Z,https://www.benzinga.com/trading-ideas/movers/25/11/49047331/alphabet-stocks-hits-new-highs-as-meta-mulls-deploying-google-ai-chips-in-data-centers,0.296,Buy
2025-11-24,NVIDIA,NVDA,Symbotic  ( SYM )  Q4 2025 Earnings Call Transcript,Motley Fool,2025-11-24T23:04:52Z,https://www.fool.com/earnings/call-transcripts/2025/11/24/symbotic-sym-q4-2025-earnings-call-transcript/,-0.4404,Sell
2025-11-24,NVIDIA,NVDA,$100 Invested In NVIDIA 5 Years Ago Would Be Worth This Much Today - NVIDIA  ( NASDAQ:NVDA ),Benzinga,2025-11-24T23:00:27Z,https://www.benzinga.com/insights/news/25/11/49047044/100-invested-in-nvidia-5-years-ago-would-be-worth-this-much-today,0.2263,Buy
2025-11-24,NVIDIA,NVDA,Keysight  ( KEYS )  Q4 2025 Earnings Call Transcript,Motley Fool,2025-11-24T22:50:01Z,https://www.fool.com/earnings/call-transcripts/2025/11/24/keysight-keys-q4-2025-earnings-call-transcript/,-0.4404,Sell
2025-11-24,NVIDIA,NVDA,Mining economics tighten as record hashrate meets falling Bitcoin price: Report,Cointelegraph,2025-11-24T22:14:36Z,https://cointelegraph.com/news/mining-economics-hashrate-bitcoin-price-report,-0.4215,Sell
2025-11-24,NVIDIA,NVDA,"Billionaire Peter Thiel Just Sold Nvidia and Tesla for These Other Two ""Magnificent Seven"" Stocks",Motley Fool,2025-11-24T22:00:00Z,https://www.fool.com/investing/2025/11/24/billionaire-peter-thiel-just-sold-nvidia-and-tesla/,0.5994,Buy
2025-11-24,NVIDIA,NVDA,"'Reason People Don't Have Kids Earlier Is They're Expensive,' Says Kevin O'Leary, But 'Elon Musk Is Making Up For The Rest Of Us' With 14 Kids - Tesla  ( NASDAQ:TSLA )",Benzinga,2025-11-24T21:31:18Z,https://www.benzinga.com/news/topics/25/11/49045443/reason-people-dont-have-kids-earlier-is-theyre-expensive-says-kevin-oleary-but-elon-musk-is-making-up,0.0,Hold
2025-11-24,NVIDIA,NVDA,Buffett Loves Japan. Should You?,Zacks Commentary,2025-11-24T21:25:00Z,https://www.zacks.com/stock/news/2795047/buffett-loves-japan-should-you,0.6868,Buy
2025-11-24,NVIDIA,NVDA,Options Corner: A Sentiment Reversal Could Awaken Tech Sleeper Hewlett Packard Enterprise - Hewlett Packard  ( NYSE:HPE ),Benzinga,2025-11-24T20:57:56Z,https://www.benzinga.com/markets/options/25/11/49044081/hpe-stock-sentiment-reversal,-0.2263,Sell
2025-11-24,NVIDIA,NVDA,"Nvidia: There Was a Red Flag in Its Earnings Report, but Is the Stock Still a Buy?",Motley Fool,2025-11-24T20:20:00Z,https://www.fool.com/investing/2025/11/24/nvidia-there-was-a-red-flag-in-its-earnings-report/,0.0,Hold
2025-11-24,NVIDIA,NVDA,"Pure-Play vs Big Tech in Quantum: How IBM, NVDA, IONQ Stand at '25 End",Zacks Commentary,2025-11-24T20:00:00Z,https://www.zacks.com/stock/news/2795044/pure-play-vs-big-tech-in-quantum-how-ibm-nvda-ionq-stand-at-25-end,0.6369,Buy
2025-11-24,NVIDIA,NVDA,"Tesla AI Chip Shockwave Flips The Trade, Stalling TSLQ Breakout - NVIDIA  ( NASDAQ:NVDA ) , Tesla  ( NASDAQ:TSLA )",Benzinga,2025-11-24T19:47:51Z,https://www.benzinga.com/etfs/specialty-etfs/25/11/49042061/tesla-stock-etf-tslq-price-trend,0.4588,Buy
2025-11-24,NVIDIA,NVDA,Is CoreWeave a Millionaire-Maker Stock?,Motley Fool,2025-11-24T19:26:00Z,https://www.fool.com/investing/2025/11/24/is-coreweave-a-millionaire-maker-stock/,0.34,Buy
2025-11-24,NVIDIA,NVDA,Broadcom Rallies As Semiconductor Stocks Surge On Fed Rate Cut Hopes - Broadcom  ( NASDAQ:AVGO ),Benzinga,2025-11-24T19:07:34Z,https://www.benzinga.com/trading-ideas/movers/25/11/49040999/broadcom-rallies-as-semiconductor-stocks-surge-on-fed-rate-cut-hopes,0.836,Buy
2025-11-24,NVIDIA,NVDA,Broadcom is joining Alphabet in the AI rally. Why investors are jumping in,CNBC,2025-11-24T18:34:24Z,https://www.cnbc.com/2025/11/24/broadcom-is-joining-alphabet-in-the-ai-rally-why-investors-are-jumping-in.html,0.296,Buy
2025-11-24,NVIDIA,NVDA,Amazon Stock Is Moving Higher Monday: What's Going On? - Amazon.com  ( NASDAQ:AMZN ),Benzinga,2025-11-24T18:04:19Z,https://www.benzinga.com/markets/tech/25/11/49039033/amazon-plans-huge-ai-upgrade-to-transform-federal-intelligence-and-security,0.8555,Buy
2025-11-24,NVIDIA,NVDA,ANET Gains From Solid Revenue Growth: Will the Uptrend Continue?,Zacks Commentary,2025-11-24T17:41:00Z,https://www.zacks.com/stock/news/2795031/anet-gains-from-solid-revenue-growth-will-the-uptrend-continue,0.9081,Buy
2025-11-24,NVIDIA,NVDA,Warren Buffett Is Buying Artificial Intelligence  ( AI )  Stocks While Michael Burry Is Shorting Them -- Who's Right?,Motley Fool,2025-11-24T17:15:00Z,https://www.fool.com/investing/2025/11/24/warren-buffett-is-buying-artificial-intelligence-a/,0.4767,Buy
2025-11-24,NVIDIA,NVDA,Michael Burry Unchained: 'Big Short' Attacks Nvidia On Substack - NVIDIA  ( NASDAQ:NVDA ),Benzinga,2025-11-24T17:05:29Z,https://www.benzinga.com/markets/tech/25/11/49036800/michael-burry-unchained-big-short-attacks-nvidia-on-substack,-0.5279,Sell
2025-11-25,Apple,AAPL,"Apple And Taiwan Semiconductor On CNBC's 'Final Trades' - Apple  ( NASDAQ:AAPL ) , Taiwan Semiconductor  ( NYSE:TSM )",Benzinga,2025-11-25T12:44:26Z,https://www.benzinga.com/analyst-stock-ratings/analyst-color/25/11/49053195/apple-taiwan-semiconductor-manufacturing-and-more-on-cnbcs-final-trades,0.7269,Buy
2025-11-25,Apple,AAPL,Is iShares Paris-Aligned Climate MSCI USA ETF  ( PABU )  a Strong ETF Right Now?,Zacks Commentary,2025-11-25T11:20:03Z,https://www.zacks.com/stock/news/2795142/is-ishares-paris-aligned-climate-msci-usa-etf-pabu-a-strong-etf-right-now,0.7184,Buy
2025-11-25,Apple,AAPL,Interested in AI Stocks? You Might Consider Buying This Top AI ETF That's Returned 210% in 3 Years,Motley Fool,2025-11-25T11:00:00Z,https://www.fool.com/investing/2025/11/25/best-ai-etf-exchange-traded-fund-best-ai-stocks/,0.1027,Buy
2025-11-25,Apple,AAPL,What's Going On With Taiwan Semiconductor Stock Tuesday? - Taiwan Semiconductor  ( NYSE:TSM ),Benzinga,2025-11-25T10:55:51Z,https://www.benzinga.com/markets/tech/25/11/49051536/taiwan-semiconductor-doubles-down-on-2nm-chips-as-ai-frenzy-fuels-billion-dollar-buildout,0.2023,Buy
2025-11-25,Apple,AAPL,CEO Jensen Huang Just Delivered Fantastic News for Nvidia Investors,Motley Fool,2025-11-25T10:30:00Z,https://www.fool.com/investing/2025/11/25/ceo-jensen-huang-just-delivered-fantastic-news-for/,0.7351,Buy
2025-11-25,Apple,AAPL,"Spotify Plans First US Price Hike Since 2024 As Profit Pressure Mounts Despite Strong User Surge: Report - Netflix  ( NASDAQ:NFLX ) , Apple  ( NASDAQ:AAPL )",Benzinga,2025-11-25T03:30:59Z,https://www.benzinga.com/markets/tech/25/11/49048779/spotify-plans-first-us-price-hike-since-2024-as-profit-pressure-mounts-despite-strong-user-surge-rep,0.0767,Buy
2025-11-25,Apple,AAPL,Earnings Season: Breaking Down Financial Statements,Zacks Commentary,2025-11-25T01:35:00Z,https://www.zacks.com/stock/news/2795089/earnings-season-breaking-down-financial-statements,-0.2263,Sell
2025-11-24,Apple,AAPL,"Billionaire Peter Thiel Just Sold Nvidia and Tesla for These Other Two ""Magnificent Seven"" Stocks",Motley Fool,2025-11-24T22:00:00Z,https://www.fool.com/investing/2025/11/24/billionaire-peter-thiel-just-sold-nvidia-and-tesla/,0.5994,Buy
2025-11-24,Apple,AAPL,iPhone 17 Boosts Apple's China Sales: What's Ahead for the Stock?,Zacks Commentary,2025-11-24T16:53:00Z,https://www.zacks.com/stock/news/2794979/iphone-17-boosts-apples-china-sales-whats-ahead-for-the-stock,0.7351,Buy
2025-11-24,Apple,AAPL,"1 Vanguard ETF to Buy Now, 1 to Avoid",Motley Fool,2025-11-24T16:17:00Z,https://www.fool.com/investing/2025/11/24/1-vanguard-etf-to-buy-now-1-to-avoid/,-0.7227,Sell
2025-11-24,Apple,AAPL,"Evaluating Apple Against Peers In Technology Hardware, Storage & Peripherals Industry - Apple  ( NASDAQ:AAPL )",Benzinga,2025-11-24T15:00:52Z,https://www.benzinga.com/insights/news/25/11/49031230/evaluating-apple-against-peers-in-technology-hardware-storage-amp-peripherals-industry,0.5413,Buy
2025-11-24,Apple,AAPL,"Congressional Trading Report: Rep. Lisa McClain Sold Over $398K In Apple Stock - Agree Realty  ( NYSE:ADC ) , Apple  ( NASDAQ:AAPL )",Benzinga,2025-11-24T15:00:23Z,https://www.benzinga.com/insights/government/25/11/49031186/congressional-trading-report-rep-lisa-mcclain-sold-over-398k-in-apple-stock,0.765,Buy
2025-11-24,Apple,AAPL,Best Health & Fitness Stocks for Investors Betting on Wellness,Zacks Commentary,2025-11-24T14:11:00Z,https://www.zacks.com/stock/news/2794693/best-health-fitness-stocks-for-investors-betting-on-wellness,0.9217,Buy
2025-11-24,Apple,AAPL,"Ranking the Best ""Magnificent Seven"" Stocks to Buy for 2026. Here's My No. 6 Pick.",Motley Fool,2025-11-24T13:59:31Z,https://www.fool.com/investing/2025/11/24/buy-magnificent-seven-stocks-2026-apple/,0.6542,Buy
2025-11-24,Apple,AAPL,"How To Trade SPY, Top Tech Stocks Using Technical Analysis - Alphabet  ( NASDAQ:GOOGL ) , Apple  ( NASDAQ:AAPL )",Benzinga,2025-11-24T13:35:57Z,https://www.benzinga.com/Opinion/25/11/49028639/how-to-trade-spy-top-tech-stocks-using-technical-analysis-64,0.8735,Buy
2025-11-24,Apple,AAPL,Prediction: Taiwan Semiconductor Will Be Worth More Than Apple by 2030,Motley Fool,2025-11-24T12:00:00Z,https://www.fool.com/investing/2025/11/24/prediction-taiwan-semicondcutor-will-be-worth-more/,0.2263,Buy
2025-11-24,Apple,AAPL,"If You'd Invested $10,000 in MP Materials Stock 5 Years Ago, Here's How Much You'd Have Today",Motley Fool,2025-11-24T12:00:00Z,https://www.fool.com/investing/2025/11/24/if-youd-invested-10000-mp-materials-stock-5-year/,0.1531,Buy
2025-11-24,Apple,AAPL,Should State Street SPDR Portfolio S&P 500 Growth ETF  ( SPYG )  Be on Your Investing Radar?,Zacks Commentary,2025-11-24T11:20:04Z,https://www.zacks.com/stock/news/2794514/should-state-street-spdr-portfolio-sp-500-growth-etf-spyg-be-on-your-investing-radar,0.3818,Buy
2025-11-24,Apple,AAPL,Is FlexShares Morningstar U.S. Market Factor Tilt ETF  ( TILT )  a Strong ETF Right Now?,Zacks Commentary,2025-11-24T11:20:04Z,https://www.zacks.com/stock/news/2794518/is-flexshares-morningstar-us-market-factor-tilt-etf-tilt-a-strong-etf-right-now,0.7184,Buy
2025-11-24,Apple,AAPL,Is Schwab Fundamental U.S. Large Company ETF  ( FNDX )  a Strong ETF Right Now?,Zacks Commentary,2025-11-24T11:20:03Z,https://www.zacks.com/stock/news/2794527/is-schwab-fundamental-us-large-company-etf-fndx-a-strong-etf-right-now,0.7184,Buy
2025-11-24,Apple,AAPL,Don't Buy Sirius XM Stock Until This Big Thing Happens,Motley Fool,2025-11-24T11:15:00Z,https://www.fool.com/investing/2025/11/24/dont-buy-sirius-xm-stock-big-thing-happens/,0.296,Buy
2025-11-24,Apple,AAPL,"Samsung's Chip Ramp-Up Revives Talk Of Closing The Taiwan Semiconductor Gap - Samsung Electronics Co  ( OTC:SSNLF ) , Taiwan Semiconductor  ( NYSE:TSM )",Benzinga,2025-11-24T11:04:52Z,https://www.benzinga.com/markets/tech/25/11/49026319/samsungs-chip-ramp-up-revives-talk-of-closing-the-taiwan-semiconductor-gap,0.8126,Buy
2025-11-24,Apple,AAPL,"Alibaba's New Qwen App Smashes 10 Million Downloads In A Week - And Sends Its Stock Soaring: Analysts See Clear Path To China's Next AI-Era WeChat - Alibaba Gr Hldgs  ( NYSE:BABA ) , Apple  ( NASDAQ:AAPL )",Benzinga,2025-11-24T09:10:14Z,https://www.benzinga.com/markets/tech/25/11/49025472/alibabas-new-qwen-app-smashes-10-million-downloads-in-a-week-and-sends-its-stock-soaring-analysts-se,0.6124,Buy
2025-11-24,Apple,AAPL,"This Is My Favorite Warren Buffett Stock, and It's One of His Biggest Bets  ( Hint: It's Not Apple or Alphabet )",Motley Fool,2025-11-24T05:31:00Z,https://www.fool.com/investing/2025/11/24/this-is-my-favorite-warren-buffett-stock-and-its-o/,0.8834,Buy
2025-11-24,Apple,AAPL,These 3 Dow Stocks Are Set to Soar in 2026 and Beyond,Motley Fool,2025-11-24T04:00:00Z,https://www.fool.com/investing/2025/11/23/these-3-dow-stocks-are-set-to-soar-in-2026-and-bey/,0.0,Hold
2025-11-23,Apple,AAPL,Prediction: These 2 AI Stocks Will Be Worth More Than Apple by Year-End 2026,Motley Fool,2025-11-23T23:30:00Z,https://www.fool.com/investing/2025/11/23/predict-ai-stocks-worth-more-than-apple-2026/,0.7152,Buy
2025-11-23,Apple,AAPL,The Vanguard 500 Index Fund ETF  ( VOO )  Offers Broader Exposure While the Vanguard Growth Index Fund ETF  ( VUG )  Delivers Higher Growth,Motley Fool,2025-11-23T22:27:01Z,https://www.fool.com/coverage/etfs/2025/11/23/the-vanguard-500-index-fund-etf-voo-offers-broader-exposure-while-the-vanguard-growth-index-fund-etf-vug-delivers-higher-growth/,0.431,Buy
2025-11-23,Apple,AAPL,What to Know Before Buying Lululemon Stock,Motley Fool,2025-11-23T21:41:00Z,https://www.fool.com/investing/2025/11/23/what-to-know-before-buying-lululemon-stock/,-0.8248,Sell
2025-11-23,Apple,AAPL,Mark Gurman Says Tim Cook Likely To Remain As Apple CEO Through At Least Mid-2026 - Apple  ( NASDAQ:AAPL ),Benzinga,2025-11-23T20:58:51Z,https://www.benzinga.com/markets/tech/25/11/49022801/mark-gurman-says-tim-cook-likely-to-remain-as-apple-ceo-through-at-least-mid-2026,0.0,Hold
2025-11-23,Apple,AAPL,"5 Reasons I Still Love Apple Stock, Even After It Soared Higher",Motley Fool,2025-11-23T19:41:00Z,https://www.fool.com/investing/2025/11/23/5-reasons-i-still-love-apple-stock-even-after-it-s/,0.9001,Buy
2025-11-23,Apple,AAPL,"Ranking the Best ""Magnificent Seven"" Stocks to Buy for 2026. Here's My No. 7 Pick.",Motley Fool,2025-11-23T18:05:00Z,https://www.fool.com/investing/2025/11/23/ranking-magnificent-seven-stocks-buy-2026-seven/,0.7814,Buy
2025-11-23,Apple,AAPL,"Weekend Round-Up: Nvidia's Record Revenue, Apple's F1 Rights, Google's Gemini 3 And Meta's AI Safety Measures - Alphabet  ( NASDAQ:GOOGL ) , Apple  ( NASDAQ:AAPL )",Benzinga,2025-11-23T12:31:04Z,https://www.benzinga.com/markets/tech/25/11/49022106/weekend-round-up-nvidias-record-revenue-apples-f1-rights-googles-gemini-3-and-metas-ai-safety-measur,0.7269,Buy
2025-11-23,Apple,AAPL,"iPhone Pocket, China Sales, $600 Million Patent Case And More: This Week In Appleverse - Apple  ( NASDAQ:AAPL ) , Advanced Micro Devices  ( NASDAQ:AMD )",Benzinga,2025-11-23T12:01:06Z,https://www.benzinga.com/markets/tech/25/11/49022054/iphone-pocket-china-sales-600-million-patent-case-and-more-this-week-in-appleverse,0.5106,Buy
2025-11-23,Apple,AAPL,"3 Vanguard ETFs to Buy With $1,000 and Hold Forever",Motley Fool,2025-11-23T00:30:00Z,https://www.fool.com/investing/2025/11/22/3-vanguard-etfs-to-buy-with-1000-and-hold-forever/,0.4404,Buy
2025-11-22,Apple,AAPL,Billionaire Warren Buffett Owns 6 Dow Jones Stocks. Here's My Top Buy for 2026.,Motley Fool,2025-11-22T23:05:00Z,https://www.fool.com/investing/2025/11/22/billionaire-warren-buffett-buy-dow-stocks-2026/,0.8658,Buy
2025-11-22,Apple,AAPL,Where Will Apple Stock Be in 5 Years?,Motley Fool,2025-11-22T18:30:00Z,https://www.fool.com/investing/2025/11/22/where-will-apple-stock-be-in-5-years/,0.6249,Buy
2025-11-22,Apple,AAPL,"Bernie Sanders Asks Whether AI Will Really Serve Workers Or 'What Mr Musk And Mr Bezos Have In Mind' As Geoffrey Hinton Reveals The Real Risk - Apple  ( NASDAQ:AAPL ) , Amazon.com  ( NASDAQ:AMZN )",Benzinga,2025-11-22T07:26:32Z,https://www.benzinga.com/markets/tech/25/11/49020085/bernie-sanders-asks-whether-ai-will-really-serve-workers-or-what-mr-musk-and-mr-bezos-have-in-mind-a,0.6652,Buy
2025-11-21,Apple,AAPL,The Vanguard S&P 500 ETF Offers Broader Diversification Than The Vanguard Mega Cap Growth ETF,Motley Fool,2025-11-21T19:42:16Z,https://www.fool.com/coverage/etfs/2025/11/21/vanguard-sp-500-etf-diversification-megacap-growth-etf/,0.705,Buy
2025-11-21,Apple,AAPL,Warren Buffett Hits the Sell Button on Multiple Core Holdings for $15.5 Billion -- Time to Panic?,Motley Fool,2025-11-21T17:05:00Z,https://www.fool.com/investing/2025/11/21/warren-buffett-hits-the-sell-button-on-a-core-hold/,-0.5106,Sell
2025-11-21,Apple,AAPL,"Exploring The Competitive Space: Apple Versus Industry Peers In Technology Hardware, Storage & Peripherals - Apple  ( NASDAQ:AAPL )",Benzinga,2025-11-21T15:00:42Z,https://www.benzinga.com/insights/news/25/11/49003152/exploring-the-competitive-space-apple-versus-industry-peers-in-technology-hardware-storage-amp-peri,0.5267,Buy
2025-11-21,Apple,AAPL,Warren Buffett Sold $3.2 Billion of Apple and Piled $4.3 Billion Into This Hot Artificial Intelligence  ( AI )  Stock,Motley Fool,2025-11-21T14:45:00Z,https://www.fool.com/investing/2025/11/21/warren-buffett-sells-32-billion-of-apple-stock-and/,0.4767,Buy
2025-11-21,Apple,AAPL,Netflix's 10-For-1 Stock Split Takes Effect: Hold for Now or Fold?  ( Revised ),Zacks Commentary,2025-11-21T10:26:00Z,https://www.zacks.com/stock/news/2793960/netflixs-10-for-1-stock-split-takes-effect-hold-for-now-or-fold-revised,0.5267,Buy
2025-11-21,Apple,AAPL,"OpenAI Teams Up With Foxconn To Design And Manufacture AI Hardware In The US - Apple  ( NASDAQ:AAPL ) , Advanced Micro Devices  ( NASDAQ:AMD )",Benzinga,2025-11-21T10:18:38Z,https://www.benzinga.com/markets/tech/25/11/48997597/openai-teams-up-with-foxconn-to-design-and-manufacture-ai-hardware-in-the-us,0.8481,Buy
2025-11-21,Apple,AAPL,Warren Buffett Is Selling Apple and Buying This Brilliant Growth Stock Instead,Motley Fool,2025-11-21T10:00:00Z,https://www.fool.com/investing/2025/11/21/warren-buffett-is-selling-apple-and-buying-this-br/,0.875,Buy
2025-11-21,Apple,AAPL,Vanguard S&P 500 ETF Offers Lower Costs Than SPDR SPY -- But Should You Care?,Motley Fool,2025-11-21T01:00:07Z,https://www.fool.com/coverage/etfs/2025/11/20/voo-offers-lower-costs-than-spy/,0.5719,Buy
